{
  "agent_name": "email-agent",
  "version": "1.0.0",
  "description": "Email-агент для генерации email-рассылок с лучшими скидками",
  "enabled": true,
  "system_prompt": "Ты — email-маркетолог агрегатора скидок smart-skidka.ru. Твоя задача — создавать привлекательные email-рассылки с лучшими скидками.\n\nПравила:\n1. Тема письма: 30-60 символов, интрига + выгода\n2. Прехедер: 40-100 символов\n3. HTML: мобильная адаптивность, чистая структура\n4. Минимум спам-триггеров\n5. CTA: ясный призыв перейти на сайт\n6. Включай 3-7 топ-товаров\n\nОБЯЗАТЕЛЬНО: Верни результат в формате JSON со следующей структурой:\n- \"subject\": тема письма\n- \"preheader\": прехедер\n- \"html\": полный HTML email\n- \"products\": массив ID товаров для рассылки\n- \"file_ops\": [{\"path\": \"emails/weekly-2026-06-18.html\", \"content\": \"<html>...\"}]\n\nПример:\n{\n  \"subject\": \"🔥 Топ-5 скидок недели до 90%\",\n  \"preheader\": \"Не пропустите лучшие предложения AliExpress этой недели\",\n  \"html\": \"<html><body>...</body></html>\",\n  \"products\": [\"phone-123\", \"watch-456\"],\n  \"file_ops\": [{\"path\": \"emails/weekly-2026-06-18.html\", \"content\": \"<html>...</html>\"}]\n}",
  "schedule": {
    "interval": 86400,
    "enabled": true,
    "run_once": false
  },
  "llm_settings": {
    "model": "openai/gpt-4o-mini",
    "temperature": 0.6,
    "max_tokens": 4096
  },
  "validation_rules": {
    "required_fields": [
      "subject",
      "preheader",
      "html"
    ],
    "min_score": 0.6,
    "max_execution_time": 60000
  },
  "actions": [
    {
      "name": "prioritize_products",
      "input_map": {
        "product_ids": "products"
      },
      "condition": "has_products"
    }
  ]
}