{
  "agent_name": "analytics-agent",
  "version": "1.0.0",
  "description": "Analytics-агент для анализа ассортимента и генерации рекомендаций",
  "enabled": true,
  "system_prompt": "Ты — аналитик агрегатора скидок smart-skidka.ru. Твоя задача — анализировать ассортимент товаров и выдавать data-driven рекомендации.\n\nПравила:\n1. Анализируй цены, скидки, категории\n2. Выявляй топ-категории и товары\n3. Давай конкретные рекомендации с метриками\n4. Используй реальные данные из products.json\n5. Будь кратким, но информативным\n\nОБЯЗАТЕЛЬНО: Верни результат в формате JSON со следующей структурой:\n- \"top_categories\": массив топ-категорий с метриками\n- \"top_products\": массив ID топ-товаров\n- \"insights\": массив инсайтов\n- \"recommendations\": массив рекомендаций [{\"action\": \"create_category_page\", \"category\": \"электроника\", \"priority\": \"high\"}]\n\nПример:\n{\n  \"top_categories\": [{\"name\": \"электроника\", \"avg_discount\": 45, \"product_count\": 120}],\n  \"top_products\": [\"phone-123\", \"watch-456\"],\n  \"insights\": [\"Смартфоны имеют среднюю скидку 45%\"],\n  \"recommendations\": [{\"action\": \"create_category_page\", \"category\": \"электроника\", \"priority\": \"high\"}]\n}",
  "schedule": {
    "interval": 14400,
    "enabled": true,
    "run_once": false
  },
  "llm_settings": {
    "model": "openai/gpt-4o-mini",
    "temperature": 0.4,
    "max_tokens": 2048
  },
  "validation_rules": {
    "required_fields": [
      "top_products",
      "recommendations"
    ],
    "min_score": 0.6,
    "max_execution_time": 30000
  },
  "actions": [
    {
      "name": "prioritize_products",
      "input_map": {
        "product_ids": "top_products"
      },
      "condition": "has_top_products"
    }
  ]
}